<?xml version="1.0"?>

<!--

file      : examples/cxx/tree/custom/mixed/people.xsd
author    : Boris Kolpackov <boris@codesynthesis.com>
copyright : not copyrighted - public domain

-->

<xsd:schema xmlns:xsd="http://www.w3.org/2001/XMLSchema"
            xmlns:ppl="http://www.codesynthesis.com/people"
            targetNamespace="http://www.codesynthesis.com/people">

  <xsd:simpleType name="gender">
    <xsd:restriction base="xsd:string">
      <xsd:enumeration value="male"/>
      <xsd:enumeration value="female"/>
    </xsd:restriction>
  </xsd:simpleType>

  <xsd:complexType name="bio" mixed="true">
    <xsd:sequence minOccurs="0" maxOccurs="unbounded">
      <xsd:any namespace="http://www.w3.org/1999/xhtml" processContents="skip"/>
    </xsd:sequence>
  </xsd:complexType>

  <xsd:complexType name="person">
    <xsd:sequence>
      <xsd:element name="first-name" type="xsd:string"/>
      <xsd:element name="last-name" type="xsd:string"/>
      <xsd:element name="gender" type="ppl:gender"/>
      <xsd:element name="age" type="xsd:unsignedShort"/>
      <xsd:element name="bio" type="ppl:bio"/>
    </xsd:sequence>
  </xsd:complexType>

  <xsd:complexType name="directory">
    <xsd:sequence>
      <xsd:element name="person" type="ppl:person" maxOccurs="unbounded"/>
    </xsd:sequence>
  </xsd:complexType>

  <xsd:element name="directory" type="ppl:directory"/>

</xsd:schema>
